{"$schema":"https://json-schema.org/draft/2020-12/schema","$id":"https://example.invalid/edu-circuit/fixture.schema.json","title":"Circuit Fixture","type":"object","required":["id","title","purpose","document","expected"],"properties":{"$schema":{"type":"string"},"id":{"type":"string","pattern":"^FIX-[0-9]{2}$"},"title":{"type":"string"},"purpose":{"type":"string"},"document":{"$ref":"circuit-document.schema.json"},"expected":{"type":"object","required":["status","tolerance","probeVoltagesV","branchCurrentsA","componentVoltagesV","componentPowersW","diagnostics","invariants"],"properties":{"status":{"enum":["solved","warning","error"]},"tolerance":{"type":"object","required":["absolute","relative"],"properties":{"absolute":{"type":"number","minimum":0},"relative":{"type":"number","minimum":0}},"additionalProperties":false},"probeVoltagesV":{"type":"object","additionalProperties":{"type":"number"}},"branchCurrentsA":{"type":"object","additionalProperties":{"type":"number"}},"componentVoltagesV":{"type":"object","additionalProperties":{"type":"number"}},"componentPowersW":{"type":"object","additionalProperties":{"type":"number"}},"diagnostics":{"type":"array","items":{"type":"string","pattern":"^[A-Z][A-Z0-9_]+$"},"uniqueItems":true},"invariants":{"type":"array","items":{"type":"string"}},"numericalResultsForbidden":{"type":"boolean"},"compareWith":{"type":"string","pattern":"^FIX-[0-9]{2}$"},"equivalentResistance":{"type":"object","required":["port","ohm"],"properties":{"port":{"type":"object","required":["first","second"],"properties":{"first":{"type":"object","required":["kind","id"],"properties":{"kind":{"enum":["terminal","junction"]},"id":{"type":"string","minLength":1}},"additionalProperties":false},"second":{"type":"object","required":["kind","id"],"properties":{"kind":{"enum":["terminal","junction"]},"id":{"type":"string","minLength":1}},"additionalProperties":false}},"additionalProperties":false},"ohm":{"type":"number","minimum":0}},"additionalProperties":false}},"additionalProperties":false}},"additionalProperties":false}