{"$schema":"../schemas/fixture.schema.json","id":"FIX-08","title":"서로 다른 이상적 전원의 병렬 연결","purpose":"같은 두 net에 다른 전압을 강제하는 조건 진단","document":{"format":"edu-circuit","version":7,"documentId":"fix-08","title":"충돌 전원","components":[{"id":"V1","type":"dc-voltage-source","label":"V1","position":{"x":0,"y":-40},"rotation":0,"properties":{"voltageV":{"numerator":"5","denominator":"1"}},"terminals":[{"id":"V1.p","role":"positive"},{"id":"V1.n","role":"negative"}]},{"id":"V2","type":"dc-voltage-source","label":"V2","position":{"x":0,"y":40},"rotation":0,"properties":{"voltageV":{"numerator":"9","denominator":"1"}},"terminals":[{"id":"V2.p","role":"positive"},{"id":"V2.n","role":"negative"}]}],"wires":[{"id":"W1","start":{"kind":"terminal","id":"V1.p"},"end":{"kind":"junction","id":"JP"},"waypoints":[]},{"id":"W2","start":{"kind":"terminal","id":"V2.p"},"end":{"kind":"junction","id":"JP"},"waypoints":[]},{"id":"W3","start":{"kind":"terminal","id":"V1.n"},"end":{"kind":"junction","id":"JN"},"waypoints":[]},{"id":"W4","start":{"kind":"terminal","id":"V2.n"},"end":{"kind":"junction","id":"JN"},"waypoints":[]}],"junctions":[{"id":"JP","position":{"x":140,"y":-40}},{"id":"JN","position":{"x":140,"y":40}}],"annotations":[],"referenceNode":{"kind":"junction","id":"JN"},"activity":null},"expected":{"status":"error","tolerance":{"absolute":1e-09,"relative":1e-09},"probeVoltagesV":{},"branchCurrentsA":{},"componentVoltagesV":{},"componentPowersW":{},"diagnostics":["CONFLICTING_SOURCES"],"invariants":["NO_FABRICATED_SOLUTION"],"numericalResultsForbidden":true}}
