{"$schema":"../schemas/fixture.schema.json","id":"FIX-13","title":"다이오드 순방향","purpose":"DIO-E02의 정확한 7/10 V 강하와 4.3 mA 검증","document":{"format":"edu-circuit","version":7,"documentId":"fix-13","title":"다이오드 순방향","components":[{"id":"V1","type":"dc-voltage-source","label":"V1","position":{"x":0,"y":0},"rotation":0,"properties":{"voltageV":{"numerator":"5","denominator":"1"}},"terminals":[{"id":"V1.p","role":"positive"},{"id":"V1.n","role":"negative"}],"operatingProfile":{"id":"edu-source","revision":1}},{"id":"R1","type":"resistor","label":"R1","position":{"x":140,"y":0},"rotation":0,"properties":{"resistanceOhm":{"numerator":"1000","denominator":"1"}},"terminals":[{"id":"R1.a","role":"a"},{"id":"R1.b","role":"b"}],"operatingProfile":{"id":"edu-resistor","revision":1}},{"id":"D1","type":"diode","label":"D1","position":{"x":280,"y":0},"rotation":0,"properties":{},"terminals":[{"id":"D1.a","role":"anode"},{"id":"D1.b","role":"cathode"}],"operatingProfile":{"id":"edu-diode-signal","revision":1}}],"wires":[{"id":"W1","start":{"kind":"terminal","id":"V1.p"},"end":{"kind":"terminal","id":"R1.a"},"waypoints":[]},{"id":"W2","start":{"kind":"terminal","id":"R1.b"},"end":{"kind":"junction","id":"J1"},"waypoints":[]},{"id":"W3","start":{"kind":"junction","id":"J1"},"end":{"kind":"terminal","id":"D1.a"},"waypoints":[]},{"id":"W4","start":{"kind":"terminal","id":"D1.b"},"end":{"kind":"terminal","id":"V1.n"},"waypoints":[]}],"junctions":[{"id":"J1","position":{"x":230,"y":0}}],"annotations":[],"referenceNode":{"kind":"terminal","id":"V1.n"},"activity":null},"expected":{"status":"solved","tolerance":{"absolute":1e-12,"relative":1e-12},"probeVoltagesV":{"V1.p":5,"J1":0.7,"V1.n":0,"R1.a":5,"R1.b":0.7,"D1.a":0.7,"D1.b":0},"branchCurrentsA":{"R1":0.0043,"D1":0.0043},"componentVoltagesV":{"R1":4.3,"D1":0.7},"componentPowersW":{"R1":0.01849,"D1":0.00301},"diagnostics":[],"invariants":["KCL","KVL","SAME_SERIES_CURRENT","PASSIVE_POWER_NONNEGATIVE"]}}
