{"$schema":"../schemas/fixture.schema.json","id":"FIX-11","title":"가변저항 (직렬)","purpose":"가변저항 조절에 따른 직렬 전류와 전압 분배 비교","document":{"format":"edu-circuit","version":7,"documentId":"fix-11","title":"가변저항 (직렬)","components":[{"id":"V1","type":"dc-voltage-source","label":"V1","position":{"x":0,"y":0},"rotation":0,"properties":{"voltageV":{"numerator":"6","denominator":"1"}},"terminals":[{"id":"V1.p","role":"positive"},{"id":"V1.n","role":"negative"}]},{"id":"R1","type":"resistor","label":"R1","position":{"x":140,"y":0},"rotation":0,"properties":{"resistanceOhm":{"numerator":"1","denominator":"1"}},"terminals":[{"id":"R1.a","role":"a"},{"id":"R1.b","role":"b"}]},{"id":"R2","type":"resistive-load","label":"VR1","position":{"x":280,"y":0},"rotation":0,"properties":{"resistanceOhm":{"numerator":"2","denominator":"1"},"resistanceMinOhm":{"numerator":"1","denominator":"1"},"resistanceMaxOhm":{"numerator":"5","denominator":"1"}},"terminals":[{"id":"R2.a","role":"a"},{"id":"R2.b","role":"b"}]}],"wires":[{"id":"W1","start":{"kind":"terminal","id":"V1.p"},"end":{"kind":"terminal","id":"R1.a"},"waypoints":[]},{"id":"W2","start":{"kind":"terminal","id":"R1.b"},"end":{"kind":"junction","id":"J1"},"waypoints":[]},{"id":"W3","start":{"kind":"junction","id":"J1"},"end":{"kind":"terminal","id":"R2.a"},"waypoints":[]},{"id":"W4","start":{"kind":"terminal","id":"R2.b"},"end":{"kind":"terminal","id":"V1.n"},"waypoints":[]}],"junctions":[{"id":"J1","position":{"x":230,"y":0}}],"annotations":[],"referenceNode":{"kind":"terminal","id":"V1.n"},"activity":null},"expected":{"status":"solved","tolerance":{"absolute":1e-09,"relative":1e-09},"probeVoltagesV":{"V1.p":6,"J1":4,"V1.n":0,"R1.a":6,"R1.b":4,"R2.a":4,"R2.b":0},"branchCurrentsA":{"R1":2,"R2":2},"componentVoltagesV":{"R1":2,"R2":4},"componentPowersW":{"R1":4,"R2":8},"diagnostics":[],"invariants":["KCL","KVL","SAME_SERIES_CURRENT","PASSIVE_POWER_NONNEGATIVE"],"equivalentResistance":{"port":{"first":{"kind":"terminal","id":"V1.p"},"second":{"kind":"terminal","id":"V1.n"}},"ohm":3}}}
