{"$schema":"../schemas/fixture.schema.json","id":"FIX-04","title":"12 V 직병렬 혼합","purpose":"직렬 전압 강하와 병렬 전류 분배의 결합 검증","document":{"format":"edu-circuit","version":7,"documentId":"fix-04","title":"직병렬 혼합","components":[{"id":"V1","type":"dc-voltage-source","label":"V1","position":{"x":0,"y":0},"rotation":0,"properties":{"voltageV":{"numerator":"12","denominator":"1"}},"terminals":[{"id":"V1.p","role":"positive"},{"id":"V1.n","role":"negative"}]},{"id":"R1","type":"resistor","label":"R1","position":{"x":130,"y":0},"rotation":0,"properties":{"resistanceOhm":{"numerator":"2","denominator":"1"}},"terminals":[{"id":"R1.a","role":"a"},{"id":"R1.b","role":"b"}]},{"id":"R2","type":"resistor","label":"R2","position":{"x":300,"y":-60},"rotation":0,"properties":{"resistanceOhm":{"numerator":"3","denominator":"1"}},"terminals":[{"id":"R2.a","role":"a"},{"id":"R2.b","role":"b"}]},{"id":"R3","type":"resistor","label":"R3","position":{"x":300,"y":60},"rotation":0,"properties":{"resistanceOhm":{"numerator":"6","denominator":"1"}},"terminals":[{"id":"R3.a","role":"a"},{"id":"R3.b","role":"b"}]}],"wires":[{"id":"W1","start":{"kind":"terminal","id":"V1.p"},"end":{"kind":"terminal","id":"R1.a"},"waypoints":[]},{"id":"W2","start":{"kind":"terminal","id":"R1.b"},"end":{"kind":"junction","id":"JM"},"waypoints":[]},{"id":"W3","start":{"kind":"junction","id":"JM"},"end":{"kind":"terminal","id":"R2.a"},"waypoints":[]},{"id":"W4","start":{"kind":"junction","id":"JM"},"end":{"kind":"terminal","id":"R3.a"},"waypoints":[]},{"id":"W5","start":{"kind":"terminal","id":"R2.b"},"end":{"kind":"junction","id":"JG"},"waypoints":[]},{"id":"W6","start":{"kind":"terminal","id":"R3.b"},"end":{"kind":"junction","id":"JG"},"waypoints":[]},{"id":"W7","start":{"kind":"junction","id":"JG"},"end":{"kind":"terminal","id":"V1.n"},"waypoints":[]}],"junctions":[{"id":"JM","position":{"x":220,"y":0}},{"id":"JG","position":{"x":390,"y":0}}],"annotations":[],"referenceNode":{"kind":"terminal","id":"V1.n"},"activity":null},"expected":{"status":"solved","tolerance":{"absolute":1e-09,"relative":1e-09},"probeVoltagesV":{"V1.p":12,"JM":6,"JG":0,"V1.n":0},"branchCurrentsA":{"R1":3,"R2":2,"R3":1},"componentVoltagesV":{"R1":6,"R2":6,"R3":6},"componentPowersW":{"R1":18,"R2":12,"R3":6},"diagnostics":[],"invariants":["KCL","KVL","PARALLEL_EQUAL_VOLTAGE","PASSIVE_POWER_NONNEGATIVE"],"equivalentResistance":{"port":{"first":{"kind":"terminal","id":"V1.p"},"second":{"kind":"terminal","id":"V1.n"}},"ohm":4}}}
