{"$schema":"../schemas/fixture.schema.json","id":"FIX-03","title":"병렬","purpose":"병렬 전압 동일성과 가지 전류 합 검증","document":{"format":"edu-circuit","version":7,"documentId":"fix-03","title":"병렬","components":[{"id":"V1","type":"dc-voltage-source","label":"V1","position":{"x":0,"y":0},"rotation":0,"properties":{"voltageV":{"numerator":"6","denominator":"1"}},"terminals":[{"id":"V1.p","role":"positive"},{"id":"V1.n","role":"negative"}]},{"id":"R1","type":"resistor","label":"R1","position":{"x":180,"y":-60},"rotation":0,"properties":{"resistanceOhm":{"numerator":"6","denominator":"1"}},"terminals":[{"id":"R1.a","role":"a"},{"id":"R1.b","role":"b"}]},{"id":"R2","type":"resistor","label":"R2","position":{"x":180,"y":60},"rotation":0,"properties":{"resistanceOhm":{"numerator":"3","denominator":"1"}},"terminals":[{"id":"R2.a","role":"a"},{"id":"R2.b","role":"b"}]}],"wires":[{"id":"W1","start":{"kind":"terminal","id":"V1.p"},"end":{"kind":"junction","id":"JT"},"waypoints":[]},{"id":"W2","start":{"kind":"junction","id":"JT"},"end":{"kind":"terminal","id":"R1.a"},"waypoints":[]},{"id":"W3","start":{"kind":"junction","id":"JT"},"end":{"kind":"terminal","id":"R2.a"},"waypoints":[]},{"id":"W4","start":{"kind":"terminal","id":"R1.b"},"end":{"kind":"junction","id":"JB"},"waypoints":[]},{"id":"W5","start":{"kind":"terminal","id":"R2.b"},"end":{"kind":"junction","id":"JB"},"waypoints":[]},{"id":"W6","start":{"kind":"junction","id":"JB"},"end":{"kind":"terminal","id":"V1.n"},"waypoints":[]}],"junctions":[{"id":"JT","position":{"x":100,"y":0}},{"id":"JB","position":{"x":280,"y":0}}],"annotations":[],"referenceNode":{"kind":"terminal","id":"V1.n"},"activity":null},"expected":{"status":"solved","tolerance":{"absolute":1e-09,"relative":1e-09},"probeVoltagesV":{"JT":6,"JB":0,"R1.a":6,"R1.b":0,"R2.a":6,"R2.b":0},"branchCurrentsA":{"R1":1,"R2":2},"componentVoltagesV":{"R1":6,"R2":6},"componentPowersW":{"R1":6,"R2":12},"diagnostics":[],"invariants":["KCL","KVL","PARALLEL_EQUAL_VOLTAGE","PASSIVE_POWER_NONNEGATIVE"],"equivalentResistance":{"port":{"first":{"kind":"terminal","id":"V1.p"},"second":{"kind":"terminal","id":"V1.n"}},"ohm":2}}}
