{"$schema":"../schemas/fixture.schema.json","id":"FIX-01","title":"단일 저항","purpose":"가장 작은 정상 회로의 전위·전류·전력 검증","document":{"format":"edu-circuit","version":7,"documentId":"fix-01","title":"단일 저항","components":[{"id":"V1","type":"dc-voltage-source","label":"V1","position":{"x":0,"y":0},"rotation":0,"properties":{"voltageV":{"numerator":"9","denominator":"1"}},"terminals":[{"id":"V1.p","role":"positive"},{"id":"V1.n","role":"negative"}]},{"id":"R1","type":"resistor","label":"R1","position":{"x":160,"y":0},"rotation":0,"properties":{"resistanceOhm":{"numerator":"9","denominator":"1"}},"terminals":[{"id":"R1.a","role":"a"},{"id":"R1.b","role":"b"}]}],"wires":[{"id":"W1","start":{"kind":"terminal","id":"V1.p"},"end":{"kind":"terminal","id":"R1.a"},"waypoints":[]},{"id":"W2","start":{"kind":"terminal","id":"R1.b"},"end":{"kind":"terminal","id":"V1.n"},"waypoints":[]}],"junctions":[],"annotations":[],"referenceNode":{"kind":"terminal","id":"V1.n"},"activity":null},"expected":{"status":"solved","tolerance":{"absolute":1e-09,"relative":1e-09},"probeVoltagesV":{"V1.p":9,"V1.n":0,"R1.a":9,"R1.b":0},"branchCurrentsA":{"R1":1},"componentVoltagesV":{"R1":9},"componentPowersW":{"R1":9},"diagnostics":[],"invariants":["KCL","KVL","PASSIVE_POWER_NONNEGATIVE"],"equivalentResistance":{"port":{"first":{"kind":"terminal","id":"V1.p"},"second":{"kind":"terminal","id":"V1.n"}},"ohm":9}}}
