{"$schema":"../schemas/fixture.schema.json","id":"FIX-07","title":"부유 하위 회로","purpose":"기준이 없는 저항망의 전위를 임의로 정하지 않음","document":{"format":"edu-circuit","version":7,"documentId":"fix-07","title":"부유 저항망","components":[{"id":"R1","type":"resistor","label":"R1","position":{"x":100,"y":-40},"rotation":0,"properties":{"resistanceOhm":{"numerator":"10","denominator":"1"}},"terminals":[{"id":"R1.a","role":"a"},{"id":"R1.b","role":"b"}]},{"id":"R2","type":"resistor","label":"R2","position":{"x":100,"y":40},"rotation":0,"properties":{"resistanceOhm":{"numerator":"20","denominator":"1"}},"terminals":[{"id":"R2.a","role":"a"},{"id":"R2.b","role":"b"}]}],"wires":[{"id":"W1","start":{"kind":"junction","id":"J1"},"end":{"kind":"terminal","id":"R1.a"},"waypoints":[]},{"id":"W2","start":{"kind":"terminal","id":"R1.b"},"end":{"kind":"junction","id":"J2"},"waypoints":[]},{"id":"W3","start":{"kind":"junction","id":"J1"},"end":{"kind":"terminal","id":"R2.a"},"waypoints":[]},{"id":"W4","start":{"kind":"terminal","id":"R2.b"},"end":{"kind":"junction","id":"J2"},"waypoints":[]}],"junctions":[{"id":"J1","position":{"x":0,"y":0}},{"id":"J2","position":{"x":200,"y":0}}],"annotations":[],"referenceNode":null,"activity":null},"expected":{"status":"warning","tolerance":{"absolute":1E-09,"relative":1E-09},"probeVoltagesV":{},"branchCurrentsA":{"R1":0,"R2":0},"componentVoltagesV":{"R1":0,"R2":0},"componentPowersW":{"R1":0,"R2":0},"diagnostics":["NONUNIQUE_OPERATING_POINT"],"invariants":["NO_ARBITRARY_REFERENCE"],"numericalResultsForbidden":false}}
