{"$schema":"../schemas/fixture.schema.json","id":"FIX-05","title":"열린 스위치","purpose":"전류가 0이어도 열린 스위치 양단에 전위차가 존재함을 검증","document":{"format":"edu-circuit","version":7,"documentId":"fix-05","title":"열린 스위치","components":[{"id":"V1","type":"dc-voltage-source","label":"V1","position":{"x":0,"y":0},"rotation":0,"properties":{"voltageV":{"numerator":"9","denominator":"1"}},"terminals":[{"id":"V1.p","role":"positive"},{"id":"V1.n","role":"negative"}]},{"id":"S1","type":"switch","label":"S1","position":{"x":140,"y":0},"rotation":0,"properties":{"state":"open"},"terminals":[{"id":"S1.a","role":"a"},{"id":"S1.b","role":"b"}]},{"id":"R1","type":"resistor","label":"R1","position":{"x":280,"y":0},"rotation":0,"properties":{"resistanceOhm":{"numerator":"9","denominator":"1"}},"terminals":[{"id":"R1.a","role":"a"},{"id":"R1.b","role":"b"}]}],"wires":[{"id":"W1","start":{"kind":"terminal","id":"V1.p"},"end":{"kind":"terminal","id":"S1.a"},"waypoints":[]},{"id":"W2","start":{"kind":"terminal","id":"S1.b"},"end":{"kind":"terminal","id":"R1.a"},"waypoints":[]},{"id":"W3","start":{"kind":"terminal","id":"R1.b"},"end":{"kind":"terminal","id":"V1.n"},"waypoints":[]}],"junctions":[],"annotations":[],"referenceNode":{"kind":"terminal","id":"V1.n"},"activity":null},"expected":{"status":"solved","tolerance":{"absolute":1e-09,"relative":1e-09},"probeVoltagesV":{"V1.p":9,"S1.a":9,"S1.b":0,"R1.a":0,"R1.b":0,"V1.n":0},"branchCurrentsA":{"S1":0,"R1":0},"componentVoltagesV":{"S1":9,"R1":0},"componentPowersW":{"R1":0},"diagnostics":[],"invariants":["KCL","KVL","OPEN_SWITCH_DISCONNECTED"]}}
