{"$schema":"../schemas/fixture.schema.json","id":"FIX-10","title":"저항 사이 접지","purpose":"FIX-02와 같은 회로에서 기준점을 중간 절점으로 바꾸어 불변식 검증","document":{"format":"edu-circuit","version":7,"documentId":"fix-10","title":"저항 사이 접지","components":[{"id":"V1","type":"dc-voltage-source","label":"V1","position":{"x":0,"y":0},"rotation":0,"properties":{"voltageV":{"numerator":"9","denominator":"1"}},"terminals":[{"id":"V1.p","role":"positive"},{"id":"V1.n","role":"negative"}]},{"id":"R1","type":"resistor","label":"R1","position":{"x":140,"y":0},"rotation":0,"properties":{"resistanceOhm":{"numerator":"3","denominator":"1"}},"terminals":[{"id":"R1.a","role":"a"},{"id":"R1.b","role":"b"}]},{"id":"R2","type":"resistor","label":"R2","position":{"x":280,"y":0},"rotation":0,"properties":{"resistanceOhm":{"numerator":"6","denominator":"1"}},"terminals":[{"id":"R2.a","role":"a"},{"id":"R2.b","role":"b"}]}],"wires":[{"id":"W1","start":{"kind":"terminal","id":"V1.p"},"end":{"kind":"terminal","id":"R1.a"},"waypoints":[]},{"id":"W2","start":{"kind":"terminal","id":"R1.b"},"end":{"kind":"junction","id":"J1"},"waypoints":[]},{"id":"W3","start":{"kind":"junction","id":"J1"},"end":{"kind":"terminal","id":"R2.a"},"waypoints":[]},{"id":"W4","start":{"kind":"terminal","id":"R2.b"},"end":{"kind":"terminal","id":"V1.n"},"waypoints":[]}],"junctions":[{"id":"J1","position":{"x":230,"y":0}}],"annotations":[],"referenceNode":{"kind":"junction","id":"J1"},"activity":null},"expected":{"status":"solved","tolerance":{"absolute":1e-09,"relative":1e-09},"probeVoltagesV":{"V1.p":3,"J1":0,"V1.n":-6,"R1.a":3,"R1.b":0,"R2.a":0,"R2.b":-6},"branchCurrentsA":{"R1":1,"R2":1},"componentVoltagesV":{"R1":3,"R2":6},"componentPowersW":{"R1":3,"R2":6},"diagnostics":[],"invariants":["REFERENCE_SHIFT_ONLY","SAME_VOLTAGE_DIFFERENCES_AS_FIX_02","SAME_CURRENTS_AS_FIX_02"],"compareWith":"FIX-02","equivalentResistance":{"port":{"first":{"kind":"terminal","id":"V1.p"},"second":{"kind":"terminal","id":"V1.n"}},"ohm":9}}}
